{
  "schemaVersion": "1.0",
  "sourceDocument": {
    "sourceRoot": "SourceMaterial",
    "relativePath": "confluence/DataModel-202735632-Practical Data- Data Governance at Scale - Conventions.xhtml",
    "sourceType": "confluence-xhtml",
    "title": "Practical Data: Data Governance at Scale - Conventions",
    "retrievedAt": "2026-02-03T18:25:29.764240",
    "confluence": {
      "pageId": "202735632",
      "space": "DataModel",
      "version": 2,
      "url": "https://maoperatingsystem.atlassian.net/spaces/DataModel/pages/202735632/Practical+Data+Data+Governance+at+Scale+-+Conventions"
    }
  },
  "requirements": [
    {
      "id": "REQ0000001",
      "kind": "Fact",
      "classification": { "primary": "Business", "tags": ["DocumentPurpose", "DocumentOverview"] },
      "brdSectionId": "BRD-01",
      "statement": "This document defines conventions used across the document series.",
      "references": [
        {
          "sourceRoot": "SourceMaterial",
          "relativePath": "confluence/DataModel-202735632-Practical Data- Data Governance at Scale - Conventions.xhtml",
          "locator": {
            "headingPath": ["Conventions"],
            "textFingerprint": "fingerprint:v1:Listed below are the conversions used in this document"
          },
          "quote": "Listed below are the conversions used in this document"
        }
      ]
    },
    {
      "id": "REQ0000002",
      "kind": "Requirement",
      "classification": { "primary": "Architecture", "tags": ["Identifier", "Naming"] },
      "brdSectionId": "BRD-08",
      "statement": "The document series must employ a context-based naming standard for unique sample IDs to represent sample data governance metadata.",
      "references": [
        {
          "sourceRoot": "SourceMaterial",
          "relativePath": "confluence/DataModel-202735632-Practical Data- Data Governance at Scale - Conventions.xhtml",
          "locator": {
            "headingPath": ["Conventions", "Unique ID Convensions"],
            "textFingerprint": "fingerprint:v1:This document employs a context-based naming standard for unique sample IDs"
          },
          "quote": "This document employs a context-based naming standard for unique sample IDs to represent sample data governance metadata."
        }
      ]
    },
    {
      "id": "REQ0000003",
      "kind": "Fact",
      "classification": { "primary": "Architecture", "tags": ["Identifier", "NodeId"] },
      "brdSectionId": "BRD-08",
      "statement": "Node ID conventions are specified by NodeType, NodeSubType, and naming convention, with examples provided.",
      "references": [
        {
          "sourceRoot": "SourceMaterial",
          "relativePath": "confluence/DataModel-202735632-Practical Data- Data Governance at Scale - Conventions.xhtml",
          "locator": {
            "headingPath": ["Conventions", "Node ID Conventions"],
            "textFingerprint": "fingerprint:v1:Node ID Conventions"
          },
          "quote": "Node ID Conventions"
        }
      ]
    },
    {
      "id": "REQ0000004",
      "kind": "Definition",
      "classification": { "primary": "Architecture", "tags": ["Identifier", "Inventory"] },
      "brdSectionId": "BRD-04",
      "statement": "For NodeType INVENTORY and NodeSubType ATTRIBUTE, the naming convention is ATT and an example ID is ATT000000001.",
      "references": [
        {
          "sourceRoot": "SourceMaterial",
          "relativePath": "confluence/DataModel-202735632-Practical Data- Data Governance at Scale - Conventions.xhtml",
          "locator": {
            "headingPath": ["Conventions", "Node ID Conventions"],
            "table": { "header": "NodeType", "row": 2, "column": 1 },
            "textFingerprint": "fingerprint:v1:INVENTORY"
          },
          "quote": "INVENTORY"
        },
        {
          "sourceRoot": "SourceMaterial",
          "relativePath": "confluence/DataModel-202735632-Practical Data- Data Governance at Scale - Conventions.xhtml",
          "locator": {
            "headingPath": ["Conventions", "Node ID Conventions"],
            "table": { "header": "Example", "row": 2, "column": 4 },
            "textFingerprint": "fingerprint:v1:ATT000000001"
          },
          "quote": "ATT000000001"
        }
      ]
    }
  ],
  "openQuestions": [
    "The Conventions page contains headings for Relationship ID Conventions but no examples beyond the heading in the exported XHTML; confirm if additional conventions exist elsewhere."
  ]
}
